Hash Index,Chapter,Subchapter,Chapter Slug,Description,Description 2,Media Link,Media Credit,Longitude,Latitude,Zoom,Marker,Marker Color,Map Credit,Tile Overlay,Tile Overlay Retina,Overlay Legend,Tile Overlay Opacity,Max Native Zoom,Top Level Overlay,Zoom to GeoJSON,GeoJSON Overlay,GeoJSON Feature Properties,GeoJSON Overlay 2,GeoJSON Feature Properties 2,Image Overlay,Image Overlay Bounds,Non-Map Content,Notes
28,,,,The Yolo Basin Wetlands Project also included a stormwater and wastewater treatment wetland for the City of Davis. The Davis Wetlands eventually became a separate Section 1135 project.,,media/fazio_davis_wetlands.jpg,Congressman Vic Fazio on an early field trip to the site of the Davis Wetlands,-121.63837,38.58306,15,Hidden,,,tiles/scan_daviswetland/{z}/{x}/{y}.png,,,,17,,,,,,,,,,
29,,,,"Over the next several years, the Yolo Basin Working Group brought together many different agencies and organizations to address agency and community concerns and to develop a management plan.","Dave Paullin, the executive director of the Central Valley Habitat Joint Venture, working with Robin Kulakow, the new Yolo Basin Foundation executive director, served as the coordinators  for the Working Group meetings from 1991-1997.  Each issue was worked through over a  number of years with multiple agencies in small group meetings. The following agencies and organizations were involved:  The State was represented by Dept. of Fish and Game (now the Department of Fish and Wildlife), The Wildlife Conservation Board, Dept. of Water Resources, and he Reclamation Board (now the Central Valley Flood Protection Board). Federal interests included US Fish and Wildlife. And the Sacramento District Corps of Engineers.  Local Districts were there too includingSacramento-Yolo Mosquito and Vector Control District, and Yolo Resource Conservation District and Reclamation District 2068. Elected officials from Davis and Yolo County, as well as staff participated.  Conservation organizations included: The Nature Conservancy, Ducks Unlimited, California Waterfowl, Yolo Audubon, Yolano chapter of Sierra Club. Yolo County Farm Bureau and farmers in the project vicinity also attended the Working Group meetings. Sacramento International Airport staff attended.",,,-121.74601,38.54673,15,Hidden,,,,,,,,,,,,,,,,,
30,,,,"The Working Group met monthly to discuss many issues including the effect of creating and managing habitat in the Yolo Bypass, a key component of the Sacramento River Flood Control System. The effect of increased wetland vegetation on movement of flood waters and the need to maintain a clear floodway was of paramount concern.","Restoration of wetlands in a flood control area was a new concept.  Growth of emergent and riparian vegetation were seen as slowing down flood flows. Slower moving flood flows could mean prolonged flooding upstream.  The Corps did extensive hydraulic modeling that was used to inform the shape, size  and direction of the proposed wetland ponds.  The percent of emergent vegetation cover (tules and cattails) was limited by pond.  Planting of riparian vegetation (trees and brush) was severely limited.  There was also concern that an increased presence of endangered species, including <span class=taxon data-taxon=swahaw>Swainson's hawks</span> and giant garter snakes, would compromise the flood control agencies’ ability to maintain the floodway. ",,,,,,,,,,,,,,,,,,,,,,,
31,,,,"Meanwhile, Yolo Basin Foundation was busy building community support for the establishment of the new wildlife area through monthly field trips to other wetlands restoration sites and to the recently purchased property.","The first Bucks for Ducks fundraiser was held in 1991 at the home of John and Judy Whitcombe, benefitting the wetlands project through an auction of wildlife art. For many years, Yolo Basin Foundation volunteers gave slideshows about the wildlife area concept to Yolo County business organizations and others, including updates to state and local agencies.",gallery:bucks-for-ducks-historic,,,,,,,,,,,,,,,,,,,,,,
32,,,,"California Duck Days, a community based  wetlands and wildlife festival, held February 1994, was the first of many family and educational activities centered around the Yolo Bypass Wildlife Area.",,gallery:duckdays-historic,,,,,,,,,,,,,,,,,,,,,,
33,,,,"In the 1990s, wetland restoration projects were less widespread and best practices not yet defined. Management of the future wetlands was a great concern for the <a href=https://www.fightthebite.net/programs/ecological-management/ target=_blank>Sacramento/Yolo Mosquito and Vector Control District</a>.","<p>Many people were concerned with the potential increase in mosquitoes in Davis and the Pocket Area of Sacramento, increasing the risk of mosquito-borne diseases. Landowners were concerned that traditional farming practices would not be tolerated near a wildlife area and their livelihood would be adversely affected.</p>
<p>The California Department of Fish and Game and Yolo Basin Foundation worked with District leadership to design a mosquito management regime that included the use of steep slopes on ponds edges, management of vegetation and specifically timed wetland flood up and draw down. These discussions were the early development of the <a href=https://www.fightthebite.net/wp-content/uploads/2018/03/symvcd-bmp-manual-english.pdf target=_blank>Mosquito Control Best Management Practices</a> used today in managed wetlands in Northern California.</p>",,,,,,,,,,,,,,,,,,,,,,,
34,,,,In January 1994 the State Reclamation Board gave final approval of a unique Memorandum of Understanding (MOU) on Threatened and Endangered Species.,"<p>This agreement was facilitated and drafted by Foundation board members and finalized by State Fish and Game attorneys. It outlines a set of actions that address the concerns of state and federal flood control agencies and state and federal wildlife management agencies. The signing of this MOU represented a model of interagency cooperation that has guided other habitat restoration efforts.  An agreement recognizing that flood control was the primary management goal in the Yolo Bypass was also drafted.</p>
<p>Representatives of The Reclamation Board, State Department of Water Resources, State Department of Fish and Game, US Fish and Wildlife Service, and the US Army Corps of Engineers signed the MOU and the Management Agreement at a special ceremony arranged by Congressman Vic Fazio in February 1994 at the West Sacramento Port headquarters.</p>",gallery:signing-ceremony,,-121.52359,38.58160,12,Plain,,,,,,,,,,,,,,,,,
35,,,,"By 1995, the designs and plans for the wetland restoration had taken shape, and construction was ready to begin! The Corps and Department of Fish and Game brought in Ducks Unlimited to manage the final design and construction of the wetlands.",,,,-121.60719,38.54275,13,Hidden,,,tiles/scan_finalmp/{z}/{x}/{y}.png,,,,17,,,,,,,,,,
36,,,,Over 150 people attended the groundbreaking ceremony in front of the ready to plant riparian area adjacent to the westside levee on 17 August 1995.,"<p>Speakers included master of ceremonies, Supervisor Betsy Marchand, Secretary of the Interior Bruce Babbitt, Congressman Vic Fazio, Brig. General Bruce Scott, Corps, Colonel John Reese, Corps, Michael Spear, Regional Director USFWS, Robin Kulakow, Yolo Basin Foundation, Douglas Wheeler, Secretary of California Resources Agency, Jim Sarro, Wildlife Conservation Board, and Dr. Alan Wentz, Ducks Unlimited. Yolo Basin Foundation received the Dept. of the Interior National Wetlands Conservation Award for the private sector, from Western Region, USFWS.</p>

<p>Brig General Bruce Scott, the Commanding officer of the Southern Pacific Region of the Army Corps of Engineers said that “the Yolo Basin Wetlands Project is, next to the restoration of the Florida Everglades, the largest project in the US.” Secretary Babbitt described the commonality with the massive Everglades restoration: “the role of partnerships; the central place of imagination; and the indispensable contributions of an individual. Cooperation among private and public entities and interests, among national, state and local governments, where narrow interests are set aside in favor of a common goal characterizes both the Yolo Basin and the Everglades project.""</p>

<p>""We are working with landscape”, Babbitt suggested. “The imagination to see in a landscape not a series of isolated, separate uses, but a harmonious blending of agriculture, urbanism and wildness, is particularly striking in the Yolo Basin Project.”</p>",gallery:groundbreaking,,-121.63107,38.53216,14,Plain,,,,,,,,,,,,,,,,,??
37,,,,"By November 1995, after months of grading and earthwork, the first phase of construction was completed, with 800 acres of new wetland ponds.","The next month, during the Sacramento Audubon Christmas bird count, the first flock of <span class=taxon data-taxon=norpin>Northern pintails</span> was observed alighting over the new ponds. Construction on the remaining wetlands continued over the next two years. A 28 acre riparian woodland was planted with native tree seedlings.  Several grassland areas were seeded with native grass seed.",gallery:construction-phase1,,-121.60533,38.53757,13,Hidden,,2002 aerial photography. Source: USGS,tiles/ortho2002/{z}/{x}/{y}.png,,,,16,,,geojson\dfw_ybwa_restoration_originalponds1997_phase1.geojson,"opacity:1;color:white;weight:3;dashArray:3,3;lineCap:butt;fillOpacity:0;",,,,,,
38,,,,"In Summer and Fall 1997, the Yolo Basin Wetlands Project finished with the construction of approximately 2300 acres of seasonal wetlands, 185 acres of semi-permanent wetlands, 28 acres of riparian woodland and 480 acres of grassland/upland.  Construction also included many miles of gravel access roads and several thousand water control structures..","The Yolo Basin Wetlands Project was the first Section 1135 project completed by the Corps. It was the largest wetlands restoration effort underway in the Western US under the <a href=https://www.fws.gov/program/north-american-wetlands-conservation/about-us target=_blank>North American Waterfowl Management Act</a>. The NAWMP is an agreement between the US, Canada, and Mexico that recognizes that the recovery and perpetuation of waterfowl and other migratory birds depends on restoring wetlands and associated ecosystems through the North American continent.",gallery:construction-phase2,,-121.60533,38.53757,13,Hidden,,2002 aerial photography. Source: USGS,tiles/ortho2002/{z}/{x}/{y}.png,,,,16,,,geojson\dfw_ybwa_restoration_originalponds1997.geojson,"opacity:1;color:white;weight:3;dashArray:3,3;lineCap:butt;fillOpacity:0;",,,,,,
39,,,,"In Summer 1997, with the wetlands construction almost completed, Yolo Basin Foundation held the first Discover the Flyway Teachers Workshop, titled <em>Reading, Writing and Wildlife</em>. The teacher workshops continue to this day. Over 1500 teachers have attended workshops prior to bringing their students to participate in a Discover the Flyway field trip.","<p>Education is at the heart of the Foundation’s mission, and in June 1997 the Yolo Basin Foundation signed a Memorandum of Understanding with California Fish and Game recognizing their long-term partnership to provide public outreach and educational programs for the Yolo Bypass Wildlife Area.</p>

<p>The same summer, the Fish and Game Operations and Maintenance Facility (Headquarters) was completed and Fish and Game staff moved in.</p>",gallery:teacher-workshops,,-121.62653,38.55067,13,Hidden,,,,,,,,,,,,,,,,,
40,,,,"On 15 November 1997, the Wildlife Area reached the national spotlight with a dedication ceremony and opening celebration attended by President Clinton and 800 community  supporters. The ceremony marked the transfer of the Wildlife Area from the US Army Corps of Engineers, who oversaw the design and construction of the project, to the California Department of Fish and Game, who would manage it going forward.","In addition to the President, speakers at the ceremony at Parking Lot C included Congressman Vic Fazio, John Garamendi, Assistant Deputy Director of US Dept. of the Interior, John Zhirsky, Assistant Secretary of Civil Works for US Army Corps of Engineers, Doug Wheeler, Secretary of State Resources Agency, Richard Rominger, Assistant Secretary of US Dept. of Agriculture. ",gallery:clinton,,-121.62086,38.54137,16,Plain,,,,,,,,,,,,,,,,,Parking Lot C
41,,,,"Yolo Basin Foundation's Robin Kulakow, Congressman Vic Fazio, Department of Interior Deputy Secretary John Garamendi and adjacent landowner and farmer Greg Schmid led President Clinton on a rainy walk along a road adjacent to the seasonal wetland ponds.  ","Right on cue, a flock of <span class=taxon data-taxon=norpin>Northern pintail</span> flushed from the pond in a spectacular demonstration of the promise of the new wetlands.",gallery:clinton-walk,,-121.62385,38.54273,16,Plain,,,,,,,,,,,,,,,,,
42,,,,"In 1998, Yolo Basin Foundation volunteers worked with Dept. of Fish and Game to construct the 3 acre Yolo Demonstration Wetlands at the Headquarters.","A grant from the US Fish and Wildlife Partners for Wildlife program and one from the US Bureau of Reclamation Wetlands program provided funding for design, earthmoving, irrigation supplies and planting equipment. The Corps provided the riparian plants. On a very hot weekend in August 1998 a Davis Boy Scout Troop  installed drip irrigation and planted 400 young trees, shrubs and grasses.   The coordination of volunteers during the weekend was the culmination of an eagle scout project.  Soon after the wetlands were flooded up for the first time in August 1998.  The Demonstration Wetlands would soon become the core of the Foundation's Discover the Flyway science and social studies program for regional K-12 students.",gallery:demowetlands-history,,-121.67235,38.55542,16,Plain,,,,,,,,,,geojson/cpad_boundary_hq.geojson,"opacity:1;color:white;weight:3;dashArray:3,3;lineCap:butt;fillOpacity:0;",,,,,,Demonstration Wetland
43,,,,Later that year Yolo Basin Foundation opened a program office in the Headquarters alongside Dept. of Fish and Game staff.  Yolo Basin Foundation launched the ongoing Flyway Nights lecture series just after moving to the new Headquarters.,,gallery:hq-history,,-121.67192,38.55593,16,Plain,,,,,,,,,,,,,,,,,
44,,,,In Spring 1998 the completion of the City of Davis Wetlands was celebrated.,The wetlands later opened to the public in Winter 2000. Yolo Basin Foundation volunteers continue to lead monthly field trips in partnership with the City of Davis.,gallery:davis-wetlands-opening,,-121.63841,38.58252,14,Plain,,,,,,,,,,geojson/davis_wetlands.geojson,"opacity:1;color:white;weight:3;dashArray:3,3;lineCap:butt;fillOpacity:0;",,,,,,
45,,,,"Over the ensuing years, the Yolo Basin Foundation continued to grow its community footprint through the <em>Discover the Flyway</em> educational program, and continued to build partnerships with public agencies, land owners, and water users.",,gallery:discover-the-flyway,,,,,,,,,,,,,,,,,,,,,,
46,,,,"The Foundation continued to facilitate the <a href=https://www.yolobasin.org/ybwg/ target=_blank>Yolo Bypass Working Group</a>, which it founded in 1998 to discuss agriculture, habitat, and water management issues among the many stakeholders with an interest in the Bypass.  ","Participants include local, state and federal  agencies and districts, elected officials, farmers, landowners, wildlife conservation groups, researchers and others with an interest in land management issues in the Bypass.  Issues of interest include flood protection, wetland management, agriculture, water quality,  wildlife and fisheries, and recreation and education. The <em>Yolo Bypass Management Strategy: A Framework for the Future</em> was the first deliverable for the group. The Working Group met regularly through 2020 (1999-2020 meeting summaries are <a href=https://www.yolobasin.org/ybwg_archive/ target=_blank>published online</a>). The Yolo Bypass Working Group received the 2000 Governor’s Environmental and Economic Leadership Award.",,,,,,,,,,,,,,,,,,,,,,,
47,,,,"The Yolo Basin Foundation has earned a reputation for collaboration with diverse public and private partners to further issues of mutual concern. Over the years it has gained the trust of the local farmers, duck club owners (privately owned and managed wetland property owners), elected officials, scientists and agency staff."," The success of the Working Group led to Yolo Basin Foundation being asked to coordinate stakeholder involvement for many <a href=https://www.yolobasin.org/yolo-bypass-studies/ target=_blank>studies and plans</a> funded by Yolo County, Sacramento Area Flood Control Agency, Dept. of Fish and Wildlife, Department of Water Resources, US Army Corps and the US Geological Service. Yolo Basin Foundation was the project grant manager for the study, <a href=https://pubs.usgs.gov/of/2009/1182/of2009-1182.pdf target=_blank><em>Methylmercury, and Other Constituents in Sediment and Water from Seasonal and Permanent Wetlands in the Cache Creek Settling Basin and Yolo Bypass, Yolo County, California, 2005−06</em></a>.",,,,,,,,,,,,,,,,,,,,,,,
48,,,,"In Winter 1999, the Yolo Bypass Wildlife Area was declared a <a href=https://www.audubon.org/important-bird-areas/yolo-bypass-area target=_blank>Globally Important Bird Area</a>.  The goal of the program is to identify sites in each state that are essential for sustaining naturally occurring populations of bird species and to protect or manage those sites for their long-term conservation. ","Designation of the Wildlife Area at the Global level is the highest level of recognition. The official designation states: <em>“This site provides habitat for globally significant numbers of waterfowl, continentally significant numbers of <span class=taxon data-taxon=leasan>Least Sandpiper</span> and <span class=taxon data-taxon=norpin>Northern Pintail</span> and nationally significant numbers of <span class=taxon data-taxon=canvas>Canvasback</span>, <span class=taxon data-taxon=dunlin>Dunlin</span> and <span class=taxon data-taxon=amwpel>American White Pelicans</span>.”</em>",media/dfeliz_flock.jpg,,,,,,,,,,,,,,,,,,,,,,
49,,,,"In the spring of 1999, the Yolo Basin Foundation moved from Robin Kulakow’s home office to a newly purchased modular office unit located at the Wildlife Area Headquarters.",The Flyway Nights lecture series was launched that same year. The Nature Bowl Semi-finals were located at the Wildlife Area for the first time for area schools. Yolo Basin Foundation’s volunteer corps continued to grow with multiple training sessions each year.,media/scans/scan0101_hq_trailer.jpg,,-121.67190,38.55581,14,Plain,,,,,,,,,,,,,,,,,
50,,,,"In 1999, the Wildlife Area was renamed in honor of Congressman Vic Fazio Yolo Bypass Wildlife Area. The Wildlife Area is an ongoing legacy of Congressman Vic Fazio’s vision and support for wetland restoration.  The Congressman passed away in 2022.",,gallery:vicfazio-dedication,,-121.63836,38.56224,14,Plain,,,,,,,,,,,,,,,,,
51,,,,"By 1999, 2,000  K-12 students and their parents had visited the Wildlife Area on <em>Discover the Flyway</em> field trips.  Thousands of people had driven  the Auto Tour loop to view wildlife.  Yolo Basin Foundation had a volunteer corps of over 100. The Fish and Wildlife Area hunting program was underway with growing popularity. In 2000, Discover the Flyway served a record 1500 students.",,,,,,,,,,,,,,,,,,,,,,,,
52,,,,<em>Plein air</em> artists flock to the Wildlife Area to capture the beauty of the wetland landscape...,,gallery:plein-air-painting,,,,,,,,,,,,,,,,,,,,,,
53,,,,...and show their work at the Art of the Bypass show and silent auction at the annual Bucks for Ducks fundraiser.,,gallery:bucks-for-ducks-current,,,,,,,,,,,,,,,,,,,,,,
54,,,,"Beginning in 2004, people began to notice a sunset flyout of bats from under the Yolo Causeway. By 2005, In response to growing interest in the bat colony, Yolo Basin Foundation began the Bat Talk and Walk program to educate visitors about the growing colony of Mexican Free-tailed bats spending the summer roosting in the expansion joints of the Causeway.",,media/bats_expansion_joint.jpg,Bats roosting in the Yolo Causeway expansion joints,-121.61507,38.56714,14,Plain,,,,,,,16,,,,,,,,,,
55,,,,"December 2001 saw a huge expansion of the Wildlife Area with the purchase of 12,000 additional acres of ranch land for the Wildlife Area.  The new size was 16,800 acres.","<p>The Glide Causeway Ranch, Giverson Ranch and Tule Ranch properties, along with the Los Rios Farms properties along Putah Creek, expanded the Wildlife Area to a total of 16,800 acres. This same year, the new Yolo Bypass Management Strategy was published by the Yolo Bypass Working Group after two years of meetings between land owners, water users, and public agencies. Work began on the Yolo Bypass Wildlife Area Land Management Plan to include the additional 12,000 acres.</p>
<p>Dept. of Fish and Game Region 2 Director, Banky Curtis, made made a commitment to the Yolo County Board of Supervisors to maintain all existing agricultural leases on these lands until a management plan was complete and land use changes initiated. Wildlife friendly farming and ranching continued.  Rice fields in the Northeast Unit were experimentally  flooded in July to provide shallow water and mudflat habitat for migrating shorebirds. This experiment became the 200 acre shorebird management requirement of the rice lease on the Wildlife Area and a state-wide model for a Farm Bill incentive program.</p>",,,-121.61700,38.49839,12,Hidden,,,,,,,,,TRUE,geojson/dfw_ybwa_boundary_expansion.geojson,"opacity:1;color:white;weight:3;dashArray:3,3;lineCap:butt;fill:true;fillOpacity:0.2;",,,,,,show the tule ranch overlay
56,,,,"In 2002-2003, while the <a href=https://www.yolobasin.org/ybwa-management-plan/ target=_blank>Land Management Plan</a> was being updated to include the expanded acreage, habitat improvements to existing seasonal  wetlands  began.","<p>These wetlands were originally restored in 1994. By 2002, the science of wetlands restoration had evolved, including the widespread use of GPS systems for surveying elevations.  It was now possible to have thousands of elevation points rather than hundreds from traditional surveying methods. This allowed for the addition of shallow benches and ridges, meandering channels, islands and scattered deep areas. Microhabitats were created by the changes in water depth as a result of the swales, islands, deep areas, and low ridges created by earthmovers.  The diversity of the wetland habitat improved significantly.</p>
<p>The improvements included new water distribution systems and rebuilt  pumps. This meant better water management to control vegetation for flood protection, wildlife food production  and the ability to move water quickly for mosquito control.  Ducks Unlimited and California Waterfowl received grants from  North American Wetlands Conservation Act and State  Duck Stamps to do this work.</p>",,,-121.60600,38.537833,13,Hidden,,2005 NAIP (National Agricultural Imagery Program) aerial orthophotos. Source: USGS,tiles/naip2005/{z}/{x}/{y}.png,,,,16,,TRUE,geojson\dfw_ybwa_restoration_2002_2003.geojson,"opacity:1;color:white;weight:3;dashArray:3,3;lineCap:butt;fillOpacity:0;",,,,,,
57,,,,More improvements came to the Wildlife Area’s existing wetlands as additional federal funding was received in 2005-2006. This resulted in more  acres of improved wetlands with a wide spectrum of microhabitats.,,,,-121.60600,38.53783,13,Hidden,,2009 NAIP (National Agricultural Imagery Program) aerial orthophotos. Source: USGS,tiles/naip2009/{z}/{x}/{y}.png,,,,16,,TRUE,geojson/dfw_ybwa_restoration_microhabitats2006.geojson,"opacity:1;color:white;weight:3;dashArray:3,3;lineCap:butt;fillOpacity:0;",,,,,,
58,,,,"Construction of two brood ponds adjacent to I-80 began in 2007, totalling 280 acres. ",Water management of brood ponds includes continuous flooding through early summer for use by ducklings and other waterbirds. The new brood ponds were integral to  improvements of the water delivery system for the rice fields,media/dwr_photos/PJH_Yolo_Bypass-0155.jpg,Sep 2009 (Paul J Hames / CA DWR),-121.62001,38.56287,14,Hidden,,2009 NAIP (National Agricultural Imagery Program) aerial orthophotos. Source: USGS,tiles/naip2009/{z}/{x}/{y}.png,,,,16,,TRUE,geojson/dfw_ybwa_restoration_broodponds.geojson,"opacity:1;color:white;weight:3;dashArray:3,3;lineCap:butt;fillOpacity:0;",,,,,,
59,,,,"Restoration was completed in 2010 on a stunning 4500 acres of new wetlands on the Glide Tule Ranch, purchased by Fish and Game in 2001.","These include traditional managed wetlands, brood ponds, ephemeral basins, ancient slough restoration and tidal wetlands.",gallery:restoration2010,,-121.60600,38.53783,13,Hidden,,2018 NAIP (National Agricultural Imagery Program) aerial orthophotos. Source: USGS,tiles/naip2018/{z}/{x}/{y}.png,,,,16,,TRUE,geojson\dfw_ybwa_restoration_2008_2009.geojson,"opacity:1;color:white;weight:3;dashArray:3,3;lineCap:butt;fillOpacity:0;",,,,,,
