Hash Index,Chapter,Subchapter,Chapter Slug,Description,Description 2,Media Link,Media Credit,Longitude,Latitude,Zoom,Marker,Marker Color,Map Credit,Tile Overlay,Tile Overlay Retina,Overlay Legend,Tile Overlay Opacity,Max Native Zoom,Top Level Overlay,Zoom to GeoJSON,GeoJSON Overlay,GeoJSON Feature Properties,GeoJSON Overlay 2,GeoJSON Feature Properties 2,Image Overlay,Image Overlay Bounds,Non-Map Content,Notes
60,,,,The extension of the Auto Tour Route opened in 2011 to take visitors through active rice fields.,"<p>If you visit in the spring you see busy farm equipment getting the soil ready for flood up and aerial seeding.  In the summer you drive by lush, green rice fields with scattered  waterbirds. In the fall you see rice harvesters hard at work with a parade of waterbirds following behind, feasting on disturbed insects and other invertebrates. In  the winter, the harvested fields are flooded for rice decomposition. The flooded fields attract thousands of birds that come to eat the leftover rice that provides carbohydrates and protein from the invertebrate soup.</p>

<p>The original 28-acres of riparian woodland planted in 1995 some of the original trees grew into large cottonwood, Oregon ash and willow trees. Many of the trees are brush like, having survived many generations of beaver activity.  The native grass seed planted in 1995 and 1996 mostly washed away or drowned during a series of mid-1990s flood events.  Several acres of meadow barley did survive the flooding and can be seen south of parking lot E.</p>",media/autotour_yvonne_hunter_80.jpg,Photo credit: Yvonne Hunter,-121.62001,38.56287,14,Hidden,,2018 NAIP (National Agricultural Imagery Program) aerial orthophotos. Source: USGS,tiles/naip2018/{z}/{x}/{y}.png,,,,16,,TRUE,geojson/ybwa_roads_riceext.geojson,opacity:1;color:white;weight:3;,,,,,,
61,,,,"<strong>The continuing story of the Yolo Basin, and the progress to date, would not be possible without the extraordinary, expansive network of colleagues, friends, and volunteers.</strong>",,media/volunteers.jpg,,0.00000,0.00000,2,Hidden,,,tiles/collage/{z}/{x}/{y}.jpg,,,,6,TRUE,,,,,,,,,
62,Managing for Many Benefits,,,"As ecosystems change, water supply fluctuates, and new scientific knowledge develops, the Yolo Bypass Wildlife Area must be actively managed to balance the parallel goals of flood protection, agriculture, wildlife conservation, recreation and education in the face of a changing climate. Adapting to shifting conditions requires continued partnerships between agencies and land owners.","In this section, we will learn about the mosaic of different land uses in the Wildlife Area, and the way they change seasonally throughout the year. This map outlines the fields and ponds that make up the Wildlife Area, colored by their uses. The Wildlife Area spans 16,800 acres including about 6,000 acres of wetlands.",media/sl_sunrise_wetland.jpg,Sunrise over seasonal wetlands © Skyler Lewis,-121.60673,38.51090,12,Hidden,,,tiles/mgmtunits/{z}/{x}/{y}.png,,media/legends/legend_landuse.png,,17,,,geojson/dfw_ybwa_boundary.geojson,"opacity:1;color:white;weight:3;dashArray:3,3;lineCap:butt;fillOpacity:0;",,,,,,
63,,Flood Protection,,The Yolo Bypass provides flood protection for hundreds of thousands of people and billions of dollars of housing and infrastructure.  Flood protection comes first in the Yolo Bypass.  ,"<p>Habitat restoration projects must all be flood neutral, meaning vegetation must not slow down flood waters. Roads and internal levees must remain under 3 feet.  All improvements require approval of the Flood Protection Board. It takes active management by Fish and Wildlife field personnel based on an annual plan to maintain the area to meet flood protection goals.</p>
<p>In spring 2011, when this aerial photo was taken, inundation of the Yolo Bypass began in March.  Flood waters of 100,000 cubic feet per second moved through the Bypass.</p>",gallery:flooding-ybwa,,-121.62615,38.50323,12,Hidden,,"Aerial photo mosaic from the March-April 2011 flood event, showing visible sediment plumes corresponding to flows from the four major tributaries of the Yolo Bypass. Source: USGS High Resolution Orthoimagery (201104_sacramento_ca_0x3000m_utm_clr)",tiles/flood_bands_2011/{z}/{x}/{y}.png,,,,16,,,geojson/dfw_ybwa_boundary.geojson,"opacity:1;color:white;weight:3;fillOpacity:0;dashArray:3,3;lineCap:butt;",,,,,,
64,,"Wetlands, Grassland and Streamside vegetation",,"<strong>Semi-permanent ponds</strong>, 4 to 5 feet deep, are filled with water year-round except when drained for vegetation removal or infrastructure improvements.","<p>These ponds provide year-round habitat for the area's resident waterfowl and wading birds, including those that nest in the Wildlife Area during the spring and summer: including <span class=taxon data-taxon=y00475>American coots</span>, <span class=taxon data-taxon=mallar3>mallards</span>, <span class=taxon data-taxon=gadwal>gadwall</span>, <span class=taxon data-taxon=cintea>cinnamon teal</span>, and <span class=taxon data-taxon=rudduc>ruddy ducks</span>. <span class=taxon data-taxon=amwpel>Pelicans</span> can be seen fishing in these ponds.</p>

<p><strong>Green's Lake</strong> in the northeast is a remnant oxbow lake that dates back to the pre-development Sacramento River Valley. It provides habitat while serving as a holding basin for rice irrigation.</p>",media/dwr_photos/PJH_Yolo_Bypass-0176.jpg,Sep 2009 (Paul J Hames / CA DWR),-121.60673,38.51090,12,Hidden,,,tiles/mgmtunits/{z}/{x}/{y}.png,,media/legends/legend_landuse.png,,17,,,geojson/dfw_ybwa_lu_permponds.geojson,"opacity:1;color:white;weight:3;fill:false;dashArray:3,3;lineCap:butt;",,,,,,
65,,,,"<strong>Seasonal wetlands</strong> are shallower, 6-18 inches deep. These ponds, planted with tule and cattail, are flooded beginning in October. They begin to dry out between February and April.",Seasonal wetlands are flooded beginning in October to provide wintering habitat for large numbers of migratory waterfowl and shorebirds.  The start of flood up is determined by the Sacramento-Yolo Mosquito and Vector Control District based on daily sampling of mosquito larvae.,media/sl_wetlands.jpg,Seasonal wetlands along the auto loop © Skyler Lewis,-121.60673,38.51090,12,Hidden,,,tiles/mgmtunits/{z}/{x}/{y}.png,,media/legends/legend_landuse.png,,17,,,geojson/dfw_ybwa_lu_seasonalwl.geojson,"opacity:1;color:white;weight:3;fill:false;dashArray:3,3;lineCap:butt;",,,,,,
66,,,,"Beginning around March 15, these seasonal ponds are no longer flooded and drained.","As they begin to dry out and the  soil warms up, wetland plants including swamp timothy, water grass and others sprout.  The seeds of these plants will provide protein rich nutrition for migratory waterfowl that arrive from late August through November.  Timely draining of seasonal wetlands occurs between  February and April before invasive weeds can establish. They are mowed and disced on a 3 to 5 year rotation. If water is available, the seasonal wetlands can be irrigated once to encourage growth of beneficial wetland plants. Some wetlands are first partially drained to provide shallow spring shorebird habitat.",gallery:seasonal-pond-succession,,-121.60673,38.51090,12,Hidden,,,tiles/mgmtunits/{z}/{x}/{y}.png,,media/legends/legend_landuse.png,,17,,,geojson/dfw_ybwa_lu_seasonalwl.geojson,"opacity:1;color:white;weight:3;fill:false;dashArray:3,3;lineCap:butt;",,,,,,
67,,,,"Wetland-associated grasslands provide cover for ground nesting birds. Limited riparian habitat lines some of the ditches, providing habitat for songbirds and raptors as well as nesting habitat for resident birds.",,media/sl_seasonal_dry.jpg,Upland habitat from the Tule Trail © Skyler Lewis,-121.60673,38.51090,12,Hidden,,,tiles/mgmtunits/{z}/{x}/{y}.png,,media/legends/legend_landuse.png,,17,,,geojson\dfw_ybwa_lu_grassland.geojson,opacity:1;color:white;weight:3;,,,,,,
68,,,,"<strong>Putah Creek</strong> flows into the Wildlife Area from the west, carrying water from Lake Berryessa and downstream tributaries.","<p>The Creek eventually flows into the east-side Toe Drain that runs alongside the levee of the Sacramento Deep Water Ship Canal, and out to the Sacramento River flowing through the Sacramento-San Joaquin Delta near Liberty Island.</p>

<p>The Toe Drain is subject to tidal action as it is directly connected to the Delta. Flap gates at the Lisbon Weir catch water moving north during the high tide. This water creates a reservoir upstream of the weir that is pumped through canals on the Wildlife Area for flooding of rice and wetlands and irrigation of pasture.</p>",gallery:putahcreek,,-121.68369,38.51633,12,Hidden,,,tiles/mgmtunits/{z}/{x}/{y}.png,,media/legends/legend_landuse.png,,17,,,geojson/nhd_osm_lowerputahck.geojson,opacity:1;color:white;weight:3;,geojson/toe_drain.geojson,"opacity:1;color:white;weight:3;dashArray:3,3;lineCap:butt;",,,,
69,,,,Stretches of <strong>riparian woodland and scrub</strong> line water bodies including Putah Creek and Green's Lake.,"Trees such as cottonwood, willow, and oregon ash support land mammals and nesting birds of prey.",gallery:riparian-forest,,-121.62064,38.54786,12,Hidden,,,tiles/mgmtunits/{z}/{x}/{y}.png,,media/legends/legend_landuse.png,,17,,,,,,,,,,
70,,Agriculture,,CA Dept. of Fish and Wildlife receives revenue from two grazing leases and a rice lease on the Wildlife Area.  ,The revenue from these five-year leases provides a substantial portion of the operations budget for management of the Wildlife Area.  The leases require wildlife friendly rice cultivation and grazing practices.  The Yolo County Resource Conservation District receives payment from Fish and Wildlife to manage the leases.,,,-121.60673,38.51090,12,Hidden,,,tiles/mgmtunits/{z}/{x}/{y}.png,,media/legends/legend_landuse.png,,17,,,geojson/dfw_ybwa_lease_rice.geojson,"opacity:1;color:white;weight:3;dashArray:3,3;lineCap:butt;fill:true;fillOpacity:0.2;",geojson/dfw_ybwa_lease_grazing.geojson,"opacity:1;color:white;weight:3;dashArray:3,3;lineCap:butt;fill:true;fillOpacity:0.2;",,,,
71,,,,"Alongside dedicated wetlands, the Wildlife Area supports a total of 2,400 acres of rice cultivation. The rice ground is located on the former Glide Causeway Ranch.","Rice is planted in May-June and harvested in September. This collaboration between local rice growers and Fish and Wildlife helps with land management costs and creates bird friendly habitat.  A mixture of short grain rice and wild rice is grown. Wild rice, actually a grass, is grown in rotation with the rice. Wild rice has a 90-day growing season, shorter than that of the rice. Rice harvested on the Wildlife Area has been sold for sushi in Japan and Korea and for brewing beer at the Fairfield Budweiser plant.",gallery:rice,,-121.61151,38.51437,12,Hidden,,,tiles/mgmtunits/{z}/{x}/{y}.png,,media/legends/legend_landuse.png,,17,,,geojson/dfw_ybwa_lease_rice.geojson,"opacity:1;color:white;weight:3;dashArray:3,3;lineCap:butt;fill:true;fillOpacity:0.2;",,,,,,
72,,,,"After the harvest, usually starting in November, the rice fields are flooded to provide additional acres of wetland habitat for migratory waterfowl and shorebirds.","Fields are eventually drained the next March as migratory waterfowl and shorebirds begin to head north, to prepare for the next season's harvest.",gallery:rice-flooded,,-121.61151,38.51437,12,Hidden,,,tiles/mgmtunits/{z}/{x}/{y}.png,,media/legends/legend_landuse.png,,17,,,geojson/dfw_ybwa_lease_rice.geojson,"opacity:1;color:white;weight:3;dashArray:3,3;lineCap:butt;fill:true;fillOpacity:0.2;",,,,,,
73,,,,Rice farmers are required by their lease to set aside 200 acres of fallow fields for summertime shorebird habitat.,"<p>These areas (which change year to year) are flooded in succession in July and August to provide the shallow water foraging habitat preferred by migrating shorebirds traveling south from northern breeding grounds.  This migration begins in July and continues through the fall.</p>
<p>Rice farming in the Yolo Bypass presents challenges due to unplanned flood events that can delay field preparation in the spring..  Rice planted in late spring can mean a late harvest that is still going on when early rains come. Wild rice with its shorter growing season is well-suited to the flood risk that Bypass farmers face.</p>",media/scans/scan0001_shorebirdpond.jpg,,-121.61484,38.54602,14,Hidden,,,tiles/mgmtunits/{z}/{x}/{y}.png,,media/legends/legend_landuse.png,,17,,,geojson/dfw_ybwa_lu_shorebirdponds.geojson,"opacity:1;color:white;weight:3;fill:false;dashArray:3,3;lineCap:butt;",,,,,,
74,,,,"About 5,000 acres of irrigated and dryland pasture supports a cattle lease on the Glide Ranch portion of the Wildlife Area. There is also a lease on several hundred acres between the railroad tracks and I-80.  Wildlife friendly grazing practices provide upland habitat alongside grazing range.","For several years there was a row crop lease on the Wildlife Area.  That lease was not renewed and the area is now in irrigated pasture. The Dept. of Fish and Wildlife staff seed small areas in safflower, corn and milo as a food and cover crop for pheasants.",media/cows_geese.jpg,Snow geese with cattle in the Causeway Ranch unit (photo courtesy Dave Feliz),-121.61151,38.51437,12,Hidden,,,tiles/mgmtunits/{z}/{x}/{y}.png,,media/legends/legend_landuse.png,,17,,,geojson/dfw_ybwa_lease_grazing.geojson,"opacity:1;color:white;weight:3;dashArray:3,3;lineCap:butt;fill:true;fillOpacity:0.2;",,,,,,
75,,,,The grasslands of the Tule Ranch section of the Wildlife Area include rare vernal pool and playa pool formations—ephemeral wetlands formed in shallow depressions that fill throughout the rainy season.,"<p>As they dry in the spring, characteristic rings of wildflowers form along the receding shoreline in response to changing soil moisture. Flowers include goldfields, miniature lupine, butter-and-eggs, downingia, monkey flower, and tidy tips. These pools contain a high diversity of plant species including some that are endangered. Several species of fairy shrimp live in the pools including the endangered Conservancy and Tadpole Fairy Shrimp.</p>
<p>Grazing is key to the survival of the plants native to the vernal pools.  Without grazing, invasive rye grass will overtake the native plants. Collaboration between Fish and Wildlife and the ranch managers is key to the survival of this increasingly rare habitat.</p>
<p>For a thorough look at the wide variety of wildflowers visible at the Tule Ranch, see <a href=https://ibrakeforwildflowers.com/glide-tule-ranch/ target=_blank>Charlie Russell’s photographs with identification</a>.</p>",media/sl_tuleranch.jpg,Vernal pools and the umbrella barn at Glide Tule Ranch © Skyler Lewis,-121.67247,38.43683,15,Hidden,,,,,,,,,,geojson/tule_ranch_vernal_pools.geojson,"opacity:1;color:white;weight:3;dashArray:3,3;lineCap:butt;",,,,,,
76,,Fish Passage and Habitat Improvements,,The Yolo Bypass is a landscape in flux. ,The Yolo Basin Foundation and its partners continue to work together to keep improving ecological function and meeting the needs of the Bypass's array of users and inhabitants as habitat needs evolve and climate changes.,media/scans/scan9905_sluice.jpg,"Management of seasonal wetland, adjusting the water level by adding boards or taking them away.",-121.62615,38.50323,12,Hidden,,2018 NAIP (National Agricultural Imagery Program) aerial orthophotos taken 14-15 July 2018. Source: USGS,tiles/naip2018_masked/{z}/{x}/{y}.png,,,,17,,TRUE,geojson/dfw_ybwa_boundary.geojson,opacity:1;color:white;weight:3;,,,,,,
77,,,,The Los Rios check dam on Putah Creek is an important feature of the Wildlife Area and adjacent agricultural water delivery system. Careful management is required to balance the hydrologic benefits of the Los Rios Check Dam to the farmers and wetland managers with the migratory needs of  the adult salmon trying to reach spawning gravels upstream..,"<p>Along with the Lisbon Weir and Road 106A crossing, the Los Rios Check Dam is a partial barrier to salmonid migration between Lake Solano on Putah Creek and the Bay-Delta estuary.</p>
<p>On 20 November, 1999, the Los Rios check dam boards were removed for the first time specifically for fall-run Chinook salmon migration up the creek. An adult salmon was spotted almost immediately starting the journey up Putah Creek to spawning gravels upstream. The restoration of salmon habitat on Putah Creek that began in 2000 continues to this day.  The continuing partnership between Dept. Fish and Wildlife, Solano County Water Agency, Putah Creek Council, Yolo Basin Foundation and adjacent farmers continue to ensure the proper timing of flows to attract fall-run salmon.  Discussions are underway to build a short channel for up-migrating salmon to bypass the Los Rios check dam.</p>
<p>The <a href=https://www.yolocounty.org/home/showpublisheddocument/23985/635339377655370000 target=_blank>Yolo Bypass Drainage and Water Infrastructure Improvement Study</a> (2014) and the <a href=https://www.yolocounty.org/home/showpublisheddocument/69617/637589118283770000 target=_blank>Study Update (2020)</a> outline drainage network improvements throughout the Yolo Bypass including the Wildlife Area.  Improvements include new control structures, higher-capacity canals, and new bridge crossings.</p>",gallery:los-rios-check-dam,,-121.61132,38.51574,14,Plain,,,,,,,,,,geojson/nhd_osm_lowerputahck.geojson,opacity:1;color:white;weight:3;,,,,,,
78,,,,"Future restoration projects in the Yolo Bypass Wildlife Area will work to restore wetland, riparian, floodplain, and tidal marsh habitats while benefiting migrating salmon.","The <a href=https://resources.ca.gov/CNRALegacyFiles/docs/ecorestore/projects/Lower_Putah_Creek_Realignment.pdf target=_blank>Lower Putah Creek Realignment Project</a> is currently under development. A new naturalized channel for Lower Putah Creek, with seasonally inundated floodplain wetlands and riparian habitat, would connect to the Toe Drain through a 90-acre restored freshwater tidal marsh. The proposed route bypasses the Los Rios Check Dam and Lisbon Weir for more direct adult fish passage from the Bay-Delta estuary 23 miles of upstream spawning habitat that terminates at the Putah Diversion Dam at Lake Solano.",gallery:realignment,,-121.60957,38.48355,13,Hidden,,,,,,,,,,geojson/realignment2015_lines.geojson,opacity:1;color:white;weight:3;fillOpacity:0;,geojson/realignment2015_wetland.geojson,opacity:1;color:white;weight:0;fillOpacity:0.2;fillColor:white;,,,,
79,,,,"An array of restoration projects are already underway throughout the greater Yolo Bypass, promising expanded floodplain habitat for fall-run salmon as well endangered winter- and spring-run salmon and green sturgeon.","<p>The Big Notch, formally known as the <a href=https://www.usbr.gov/mp/bdo/yolo-bypass.html target=_blank>Yolo Bypass Salmonid Habitat Restoration and Fish Passage Project</a>, is under construction at the Fremont Weir.  This new operable gate will connect the Sacramento River to the Tule Canal through an operable gate in the Fremont Weir.  The lower gate elevation will increase water flows into the Bypass. Juvenile Chinook salmon will benefit from larger and longer-lived food-rich floodplain rearing habitat. </p>
<p>Adult fall-run and endangered, winter and spring-run Chinook salmon and green sturgeon will face fewer delays when returning to their upstream spawning grounds, both from the Big Notch and from the concurrent <a href=https://resources.ca.gov/CNRALegacyFiles/docs/ecorestore/projects/Fremont_Weir_Fish_Passage.pdf target=_blank>Fremont Weir Adult Fish Passage Project</a>.</p>",gallery:big-notch,,-121.65049,38.76069,15,Hidden,,,,,,,,,,geojson/srfcp_weirs_fremont.geojson,opacity:1;color:white;weight:3;fillOpacity:0;,geojson/big_notch_channel_lines.geojson,"opacity:1;color:white;weight:3;fillOpacity:0;dashArray:3,3;lineCap:butt;",,,,
80,,,,"Ongoing partnerships between the Yolo Basin Foundation, Yolo County, Dept. of Fish and Wildlife and Dept of Water Resources, Ducks Unlimited, and Metropolitan Water District are working to address flooding impacts to Yolo Bypass agriculture and wetlands caused by the anticipated increase in frequency and duration of flows due to operation the Big Notch project.","The <a href=https://www.ducks.org/conservation/wr/california/yolo-bypass-habitat-drainage-improvement-projecttarget=_blank>Yolo Bypass Wildlife Area Habitat & Drainage Improvement Project</a> is led by Ducks Unlimited and supported by a coalition of partners, including California Department of Fish and Wildlife (CDFW), Yolo County, Yolo Basin Foundation, and the Metropolitan Water District of Southern California. Identified as the top priority in Yolo County’s 2014 Yolo Bypass Drainage & Water Infrastructure Improvement Study, the project includes five major components to enhance management of wetland resources and agricultural operations. Project improvements will allow the CDFW to: add 220 acres of managed wetlands, increase the productivity of existing wetlands, improve wildlife-friendly management of rice fields, reduce on-site flooding from the South Davis Drain, increase and improve public access and maintenance.  This project is funded with grants from the Delta Conservancy, State Dept of Fish and Game, and State Duck Stamps.",gallery:drainage,,-121.62615,38.50323,12,Hidden,,2018 NAIP (National Agricultural Imagery Program) aerial orthophotos taken 14-15 July 2018. Source: USGS,tiles/naip2018_masked/{z}/{x}/{y}.png,,,,17,,TRUE,geojson/dfw_ybwa_boundary.geojson,opacity:1;color:white;weight:3;,,,,,,
81,,,,"Finally, additional restoration work is underway in the greater Yolo Bypass, including the <a href=https://water.ca.gov/Programs/Flood-Management/Flood-Projects/Lower-Elkhorn-Basin target=_blank>Lower Elkhorn setback levee</a>, an expanded Sacramento Weir and floodplain restoration in the Sacramento Bypass; a new fish rescue facility at the <a href=https://resources.ca.gov/CNRALegacyFiles/docs/ecorestore/projects/Wallace_Weir_Modification.pdf target=_blank>Wallace Weir</a>; and a fish-friendly reconfiguration of the Wildlife Area’s adjacent <a href=https://resources.ca.gov/CNRALegacyFiles/docs/ecorestore/projects/Lisbon_Weir.pdf target=_blank>Lisbon Weir</a>.",,gallery:lisbon-weir,Lisbon Weir,,,,,,,,,,,,,,,,,,,,,
82,,Recreation and Education,,"Beyond flood protection, wetland habitat, and agriculture, the Yolo Bypass Wildlife Area benefits the regional community with an array of recreation and education opportunities. ","In the next section, learn more about the opportunities awaiting visitors to the Yolo Bypass Wildlife Area today.",media/education2.jpg,"Yolo Basin Foundation volunteer and retired State Fish and Wildlife Deputy Director, Rob Floerke, leads a field trip for a local school in 1995, before the Discover the Flyway program was started.",,,,,,,,,,,,,,,,,,,,,
83,Visiting the Wildlife Area,,,The Yolo Bypass Wildlife Area is located off Interstate 80 between Davis and Sacramento.,Take exit 78 from I-80 to visit the wildlife area (just east of the exit) and the headquarters (2 miles west on Chiles Rd).,media/sacramento.jpg,,-121.61151,38.51437,12,Hidden,,2018 NAIP (National Agricultural Imagery Program) aerial orthophotos taken 14-15 July 2018. Source: USGS,tiles/naip2018_masked/{z}/{x}/{y}.png,,,,17,,,geojson/dfw_ybwa_boundary.geojson,"opacity:1;color:white;weight:3;dashArray:3,3;lineCap:butt;fillOpacity:0;",geojson/cpad_boundary_hq.geojson,"opacity:1;color:white;weight:3;dashArray:3,3;lineCap:butt;fillOpacity:0;",,,,
84,,,,"Take advantage of the popular <strong>auto tour loop</strong> for year-round wildlife viewing that passes through permanent ponds, seasonal wetlands, and rice fields.",,media/autoloop.jpg,,-121.62382,38.54579,14,Hidden,,2018 NAIP (National Agricultural Imagery Program) aerial orthophotos taken 14-15 July 2018. Source: USGS,tiles/naip2018_masked/{z}/{x}/{y}.png,,,,17,,,geojson/dfw_ybwa_accesszone_viewing.geojson,"opacity:1;color:white;weight:3;dashArray:3,3;lineCap:butt;fill:true;fillOpacity:0.2;",geojson/ybwa_roads_autoloop.geojson,opacity:1;color:white;weight:5;,,,,
85,,,,Several hiking trails are accessible year round.,Get out of the car at Parking Lot C and walk the loop along the Tule Trail to see seasonal wetlands to the west and permanent ponds to the east.,media/waterfowl_flock_ann.jpg,,-121.62382,38.54579,14,Hidden,,2018 NAIP (National Agricultural Imagery Program) aerial orthophotos taken 14-15 July 2018. Source: USGS,tiles/naip2018_masked/{z}/{x}/{y}.png,,,,17,,,geojson/dfw_ybwa_accesszone_viewing.geojson,"opacity:1;color:white;weight:3;dashArray:3,3;lineCap:butt;fill:true;fillOpacity:0.2;",geojson/ybwa_trails_yearround.geojson,opacity:1;color:white;weight:5;,,,,
86,,,,"In the late fall and winter, the Wildlife Area is a hunting destination. ","Duck hunting season begins in October and extends through January, while pheasant season begins mid-November. The hunting area begins at a check-point and is separate from the year-round public wildlife viewing zone. Wildlife viewers are kept at a safe distance from hunting activity.",media/hunters2.jpg,,-121.61151,38.51437,12,Hidden,,2018 NAIP (National Agricultural Imagery Program) aerial orthophotos taken 14-15 July 2018. Source: USGS,tiles/naip2018_masked/{z}/{x}/{y}.png,,,,17,,,geojson/dfw_ybwa_accesszone_hunting.geojson,"opacity:1;color:white;weight:3;dashArray:3,3;lineCap:butt;fill:true;fillOpacity:0.2;",,,,,,
