Hash Index,Chapter,Subchapter,Chapter Slug,Description,Description 2,Media Link,Media Credit,Longitude,Latitude,Zoom,Marker,Marker Color,Map Credit,Tile Overlay,Tile Overlay Retina,Overlay Legend,Tile Overlay Opacity,Max Native Zoom,Top Level Overlay,Zoom to GeoJSON,GeoJSON Overlay,GeoJSON Feature Properties,GeoJSON Overlay 2,GeoJSON Feature Properties 2,Image Overlay,Image Overlay Bounds,Non-Map Content,Notes
1,,,,This virtual tour tells the history of the Yolo Basin Foundation and the geography of the Yolo Bypass Wildlife Area. ,"Scroll through the multimedia narrative and explore the accomanying map layers, or use the buttons above to jump to a particular chapter. You can also zoom in and out on the map using the +/- controls, and click to zoom/pan.",,,-121.62615,38.50323,12,Hidden,,2018 NAIP (National Agricultural Imagery Program) aerial orthophotos taken 14-15 July 2018. Source: USGS,tiles/naip2018_masked/{z}/{x}/{y}.png,,,,17,,TRUE,geojson/dfw_ybwa_boundary.geojson,opacity:1;color:white;weight:3;,,,,,,
2,The Watershed and the Flyway,,watershed,"The <strong>Central Valley</strong>, California's agricultural heartland, is an 18,000-square-mile sedimentary valley, fed by vast watershed of the Sacramento and San Joaquin Rivers. ","The valley's drainage area extends to the crests of the Sierra Nevada and the coast range, a catchment for rain and snowmelt that encompasses 60,000 square miles. Water from the Sacramento and San Joaquin Rivers and their tributaries converge at the Sacramento-San Joaquin Delta—a highly modified landscape of tidal sloughs and canals surrounding levee-protected agricultural lowlands—before flowing out to sea via the San Francisco Bay.",,,-121.63123,38.56149,7,Hidden,,"Geospatial data sources: USGS NHD+, California Natural Resources Agency.",tiles/watershed/{z}/{x}/{y}.png,,media/legends/legend_watershed.png,,12,,,geojson/dfw_ybwa_boundary.geojson,opacity:1;color:white;weight:3;fillOpacity:0;,,,,,,
3,,,,"Located in the northern Sacramento-San Joaquin Delta, the <strong>Yolo Basin</strong> is a vast, low-lying historic wetland area, filled by distributary streams from the west and Sacramento River overflow to the east.",,,,-121.60566,38.40822,11,Hidden,,Early 1900s <a href=https://ngmdb.usgs.gov/topoview/ target=_blank>USGS topographic maps</a> (1:32000 and 1:64000 scale). 32k mosaic basemap layer published by <a href=https://map.dfg.ca.gov/arcgis/rest/services/Base_Maps/Topo_Delta_Early_1900s/ImageServer target=_blank>California Department of Fish & Wildlife</a>.,tiles/topo1907/{z}/{x}/{y}.png,,,,15,,TRUE,geojson/topo_yolobasin_wetland.geojson,"opacity:1;color:red;weight:3;fillOpacity:0;dashArray:3,3;lineCap:butt;",geojson/dfw_ybwa_boundary.geojson,opacity:1;color:black;weight:3;fillOpacity:0;,,,,
4,,,,"One of the Basin's major western tributaries is <strong>Putah Creek</strong>, whose water historically spread out and infiltrated into the soil at the <strong>Putah Creek Sinks</strong>.",,media/scans/img004_putahsinks.jpg,"Putah Creek Sinks, 1950, showing Cowell Ranch and Glide Ranch in background.",-121.61151,38.51437,14,Hidden,,Early 1900s <a href=https://ngmdb.usgs.gov/topoview/ target=_blank>USGS topographic maps</a> (1:32000 and 1:64000 scale). 32k mosaic basemap layer published by <a href=https://map.dfg.ca.gov/arcgis/rest/services/Base_Maps/Topo_Delta_Early_1900s/ImageServer target=_blank>California Department of Fish & Wildlife</a>.,tiles/topo1907/{z}/{x}/{y}.png,,,,15,,,,,geojson/dfw_ybwa_boundary.geojson,opacity:1;color:black;weight:3;fillOpacity:0;,,,,
5,,,,"The Central Valley was once a complex mosaic of grasslands and riparian forests, transitioning to freshwater wetlands and tidal channels at the Delta.","The riparian forests lining rivers like the Sacramento and tributary streams like Putah and Cache Creeks had lush canopies of valley oak, sycamore, and cottonwood. Along the edges of the valley were foothills of valley oak savanna (<em>roblar</em>).",media/history/4658009.jpg,1852 lithographs of the Sacramento River by William H. Dougal. Source: <a href=https://www.davidrumsey.com/luna/servlet/s/0k0f6e target=_blank>David Rumsey Map Collection</a>.,-121.63123,38.56149,8,Hidden,,Central Valley data from <a href=https://www.waterboards.ca.gov/waterrights/water_issues/programs/bay_delta/docs/cmnt081712/sldmwa/csuchicodptofgeographyandplanningcentralvalley.pdf target=_blank>Central Valley Historic Mapping Project</a> via <a href=https://databasin.org/datasets/53783ba3685642509030100ae9a221d1/ target=_blank>DataBasin</a>. Fine-scale mapping via San Francisco Estuary Institute (SFEI) <a href=https://www.sfei.org/DeltaHEStudy target=_blank>Sacramento-San Joaquin Delta Historical Ecology Study</a>. Categories are combined and adjusted for presentation.,tiles/histeco/{z}/{x}/{y}.png,,media/legends/legend_histeco.png,,12,,,geojson/dfw_ybwa_boundary.geojson,opacity:1;color:white;weight:3;fillOpacity:0;,,,,,,
6,,,,"The Yolo Basin was covered in freshwater emergent tule wetland (or <em>tulare</em> in early Californian Spanish), flanked by seasonal wet meadows.","At the Putah Creek sinks, el Río de los Putos branched out in distributary channels as it passed through a vast willow thicket (<em>sausal</em>). The San Francisco Estuary Institute (SFEI) reconstructed these historical ecological boundaries based on 18th to 19th century expedition reports and survey maps.",media/history/laying_tules_in_preparation_for_burning.jpg,Laying tules in preparation for burning. Source:  Sacramento Archives & Museum Collection Center via <a href=https://wildlife.ca.gov/Lands/Planning/Yolo-Bypass-WA target=_blank>Yolo Bypass Wildlife Area Land Management Plan</a>.,-121.62615,38.50323,12,Hidden,,Central Valley data from <a href=https://www.waterboards.ca.gov/waterrights/water_issues/programs/bay_delta/docs/cmnt081712/sldmwa/csuchicodptofgeographyandplanningcentralvalley.pdf target=_blank>Central Valley Historic Mapping Project</a> via <a href=https://databasin.org/datasets/53783ba3685642509030100ae9a221d1/ target=_blank>DataBasin</a>. Fine-scale mapping via San Francisco Estuary Institute (SFEI) <a href=https://www.sfei.org/DeltaHEStudy target=_blank>Sacramento-San Joaquin Delta Historical Ecology Study</a>. Categories are combined and adjusted for presentation.,tiles/histeco/{z}/{x}/{y}.png,,media/legends/legend_histeco.png,,12,,,geojson/dfw_ybwa_boundary.geojson,opacity:1;color:white;weight:3;fillOpacity:0;,,,,,,
,,,,The Patwin people are the indigenous inhabitants of the southwestern drainage of the Sacramento River.,"<p>Patwin people lived in villages throughout the Yolo Basin and Sacramento River Valley, located on local high ground such as natural river levees and knolls, and benefited from the rich floodplains for fishing Chinook salmon, hunting deer and elk, and gathering tule reeds to weave into homes and baskets.</p>
<p>Starting in the 1800s, the Patwin were forcibly removed from their villages and hunting lands through successive waves of colonization: from the Spanish mission project, in which Patwin villages were raided for laborers, slaves, and converts; to an epidemic of malaria introduced by European trappers in the river valley; to the claims and appropriation of indigenous land for the Spanish land grants followed by the Gold Rush; to the ultimate relocation of remaining Patwin to federally created rancherías or reservations. </p>
<p>Today’s surviving Patwin communities include the Yocha Dehe Wintun Nation, who are now based along Cache Creek in the Capay Valley of eastern Yolo County, having reclaimed the fertile lowland river corridor after being relocated to the dry upper reaches of the valley in Rumsey. The term Patwin, or Wintun Tʼewe, refers more precisely to the language traditionally spoken in this region. While the local Southern dialect of Patwin (spoken in what is now central Yolo County from Putah Creek to Suisun Bay) became extinct after contact with Spanish settlers, the Patwin language is undergoing a revival and being taught again in tribal schools.</p>",,,-121.65647,38.56149,9,Hidden,,"Present-day Indian Lands and Native Entities published by CA Governor's Office of Emergency Services. Historic Native American Territories in California published by University of Redlands. Patwin place names from Napa Valley Historical Society as published by Noahedits on Wikimedia Commons. Historic delta waters from San Francisco Estuary Institute (SFEI) <a href=https://www.sfei.org/DeltaHEStudy target=_blank>Sacramento-San Joaquin Delta Historical Ecology Study</a> and sacramentoriver.org GIS library. Other geospatial data: USGS NHD+, California Natural Resources Agency.",tiles/indigenous/{z}/{x}/{y}.png,,media/legends/legend_indigenous.png,,12,TRUE,,geojson/dfw_ybwa_boundary.geojson,opacity:1;color:white;weight:3;fillOpacity:0;,,,,,,
7,,,,"Euro-American settlement began with the Mexican land grant <em>ranchos</em>, then expanded as the Delta's fertile soil attracted farmers and ranchers during the Gold Rush period.","The natural levees on the banks of the Sacramento River supported settlements and farms, including the growing city of Sacramento (formerly known as New Helvetia).",media/history/eliason1854_putahckmap.jpg,"Land grant boundary map of Laguna de Santos Callé showing Putah Creek, the Putah Creek Sinks, and the <em>tulares</em>. Source: <a href=https://oac.cdlib.org/ark:/13030/hb7s2007h1>Online Archive of California</a>",-121.65647,38.56149,10,Hidden,,<a href=https://www.davidrumsey.com/luna/servlet/s/gf6741 target=_blank>Map of the Valley of the Sacramento including the Gold Region (1848)</a> retrieved from David Rumsey Map Collection.,https://maps.georeferencer.com/georeferences/d85fd9e7-b5d8-58d0-aec0-5a2cb7b3dd87/2017-08-31T15:04:39.928237Z/map/{z}/{x}/{y}.png?key=ErxjTsmpWTEz22fnURYn,,,,,TRUE,,,,,,,,,
8,,,,"Beginning with the Swamp Land Act of 1850, earthen flood control levees and irrigation canals were constructed to support Delta farming by 'reclaiming' seasonal wetlands like the Yolo Basin.","Settlements in the Sacramento Valley continued to grow, vulnerable to rising river levels from winter storms and spring snowmelt that culminated in the destructive flood of 1862.",media/flood1862.jpg,"Lithograph of K Street in the city of Sacramento, California, during the Great Flood of 1862. Source: <a href=https://oac.cdlib.org/ark:/13030/tf2b69p086 target=_blank>Online Archive of California</a>",-121.65647,38.56149,10,Hidden,,<a href=https://www.davidrumsey.com/luna/servlet/s/0q60xw target=_blank>State Engineer's Map of Northern California (1884)</a> retrieved from David Rumsey Map Collection.,https://maps.georeferencer.com/georeferences/98362a82-b851-5bb7-93b5-447dca2a9930/2020-06-22T20:26:56.697369Z/map/{z}/{x}/{y}.png?key=ErxjTsmpWTEz22fnURYn,,,,,TRUE,,,,,,,,,
9,,,,"In 1917, the US Congress authorized the <strong><a href=https://www.rd108.org/wp-content/uploads/2015/07/WeirsReliefStructures.pdf target=_blank>Sacramento River Flood Control Project</a></strong>, a system of levees and weirs that direct flood waters away from developed areas and into the designated undeveloped Sutter and Yolo bypasses.",,https://www.youtube.com/embed/cMCge2mZCWc,<a href=https://www.youtube.com/watch?v=cMCge2mZCWc target=_blank>Animated overview of the Sacramento River Flood Control System</a> produced by the US Army Corps of Engineers,-121.65647,38.56149,9,Hidden,,"Geospatial data sources: USGS NHD+, California Natural Resources Agency, SACOG.",tiles/floodctrl/{z}/{x}/{y}.png,,media/legends/legend_floodctrl.png,,13,,,geojson/dfw_ybwa_boundary.geojson,opacity:1;color:white;weight:3;fillOpacity:0;,,,,,,
10,,,,"The 92-square-mile <strong>Yolo Bypass</strong> begins at Fremont Weir near Knights Landing, along the Sacramento River and extends south to the Delta. The Fremont Weir is located just below the junction of the  Feather River and Sacramento Rivers.","<p>The <a href=https://www.rd108.org/wp-content/uploads/2015/07/WeirsReliefStructures.pdf target=_blank>Fremont Weir</a> is a 2 mile wide low concrete structure where Sacramento River flood water flows into the Yolo Bypass. When <a href=https://water.weather.gov/ahps2/hydrograph.php?wfo=sto&gage=fmwc1&hydro_type=2 target=_blank>river stage exceeds 32 feet</a>,Sacramento River flood waters flow over the Fremont moving  south while also rising from the east side toe drain and expanding westward. Fully inundated, the Yolo Bypass becomes a vast ""inland sea,"" conveying flood waters from eastside and westside sources across the Yolo Basin floodplain, re-entering the Sacramento River near Prospect and Liberty Islands.</p>
<p>The California Department of Water Resources can manually open and close the Sacramento Weir located on the eastside of the Bypass near I-80 bridge over the Sacramento River near West Sacramento.  DWR staff remove boards on the Sacramento Weir to let in additional water from the Sacramento and American Rivers. This water flows west through the Sacramento Bypass and meets up with the Yolo Bypass.</p>
<p>The Bypass also receives periodic inflow from Cache Creek, Knights Landing Ridge Cut, Willow Slough and Willow Slough Bypass. Putah Creek provides a perennial inflow into the east side toe drain. During flood events these westside tributaries provide fast rising, uncontrolled flood waters into the Bypass.  Uncontrolled westside flood flows  can occur before, during or after the Fremont Weir spills.</p>",gallery:flood-control-structures,,-121.62615,38.50323,11,Hidden,,"Geospatial data sources: USGS NHD+, California Natural Resources Agency, SACOG.",tiles/floodctrl/{z}/{x}/{y}.png,,media/legends/legend_floodctrl.png,,13,,,geojson/dfw_ybwa_boundary.geojson,"opacity:1;color:white;weight:3;fillOpacity:0;dashArray:3,3;lineCap:butt;",,,,,,
11,,,,"The different sources of water are visible in this aerial photograph from the March-April 2011 storm, owing to the varying sediment loads in the Sacramento River versus the tributary streams.",,gallery:flooding,,-121.62615,38.50323,12,Hidden,,"Aerial photo mosaic from the March-April 2011 flood event, showing visible sediment plumes corresponding to flows from the four major tributaries of the Yolo Bypass. Source: USGS High Resolution Orthoimagery (201104_sacramento_ca_0x3000m_utm_clr)",tiles/flood_bands_2011/{z}/{x}/{y}.png,,,,16,,TRUE,geojson/dfw_ybwa_boundary.geojson,"opacity:1;color:white;weight:3;fillOpacity:0;dashArray:3,3;lineCap:butt;",,,,,,
12,,,,"Before the Yolo Causeway was built, there was no year-round route across the wetlands.","A series of seasonal roads including the Tule Jack Road led through the <em>tulares</em>, as seen in this Gold Rush era map, but winter travelers had to venture across the flooded tule marshes by ferryboat, a dangerous crossing during high waters. To facilitate crossing the Yolo Bypass and expand commerce between Sacramento and the San Francisco Bay Area, the Yolo Causeway was built around the same time as the flood control project, in 1917.",gallery:causeway-history,,-121.62615,38.50323,10,Hidden,,<a href=https://www.davidrumsey.com/luna/servlet/s/ty5830 target=_blank>Gold And Quicksilver District Of California (1848)</a> retrieved from David Rumsey Historical Map Collection.,https://maps.georeferencer.com/georeferences/c8573850-969d-56c9-96ff-be148204dc9e/2020-03-24T09:20:00.439491Z/map/{z}/{x}/{y}.png?key=ErxjTsmpWTEz22fnURYn,,,,,TRUE,,,,,,,,,
13,,,,"One of the early settlers of the Yolo Basin was J.H. Glide, who purchased a large area in the 1870s that would eventually become much of the Yolo Bypass Wildlife Area.","The Glide family reclaimed the wetlands of the Putah Creek Sinks, turning thousands of acres into dry grazing land, and built a large and successful cattle and sheep business.",gallery:glide-ranch-history,,-121.62615,38.50323,12,Hidden,,"<a href=https://www.davidrumsey.com/luna/servlet/s/mfs344 target=_blank>Official Map of Yolo County, California. Compiled from Official Records by C.C. Stitt, County Surveyor, 1939</a> retrieved from David Rumsey Historical Map Collection.",https://maps.georeferencer.com/georeferences/efae4b4e-e150-5ff4-b891-0330f3868f2b/2017-02-20T14:25:19.132722Z/map/{z}/{x}/{y}.png?key=ErxjTsmpWTEz22fnURYn,,,,,TRUE,,geojson/historic_glide_ranch.geojson,"opacity:1;color:white;weight:3;fillOpacity:0;dashArray:3,3;lineCap:butt;",,,,,,
14,,,,"The Yolo Bypass is an important stop along the <strong>Pacific Flyway</strong>, a north-south migratory pathway along which millions of birds travel each year. Sacramento Valley wetlands provide critical overwintering habitat for waterfowl, shorebirds, songbirds, and raptors that then return to the various points west and north including the Canadian Arctic for the summer.",The lines on this map are GPS tracks of migratory ducks and geese collected by the USGS Dixon Field Station.,,,-118.04555,47.08791,3,Hidden,,"Bird migration data courtesy of USGS Western Ecological Research Center, Dixon Field Station. Special thanks to Mike Casazza and Cory Overton.",tiles/flyway/{z}/{x}/{y}.png,,media/legends/legend_flyway.png,,8,,,,,,,,,,
15,,,,"Over time, more and more wetland habitat in the Yolo Basin, the Delta and the greater Sacramento Valley was drained and converted to agricultural and urban land….",,,,-121.61484,38.54602,14,Hidden,,1937 aerial photography for the Sacramento/San Joaquin Delta. Source: basemap layer published by <a href=https://map.dfg.ca.gov/arcgis/rest/services/Base_Remote_Sensing/Sacramento_Delta_1937/ImageServer target=_blank>California Department of Fish & Wildlife</a>.,tiles/ortho1937/{z}/{x}/{y}.png,,,,16,,,geojson/dfw_ybwa_boundary.geojson,"opacity:1;color:white;weight:3;fillOpacity:0;dashArray:3,3;lineCap:butt;",,,,,,
16,,,,"By the 1990s, almost no remnant wetland habitat remained in the Yolo Basin.",,,,-121.61484,38.54602,14,Hidden,,1993 aerial photography (USGS Digital Ortho Quads),tiles/ortho1993/{z}/{x}/{y}.png,,,,16,,,geojson/dfw_ybwa_boundary.geojson,"opacity:1;color:white;weight:3;fillOpacity:0;dashArray:3,3;lineCap:butt;",,,,,,
17,Founding YBF and the Wildlife Area,,,"The origin story of the Yolo Basin Foundation and the Yolo Bypass Wildlife Area is a story of partnerships. Creating, protecting, and managing these thousands of acres of wetland habitat required cooperation between local, state and federal agencies and private landowners, hunters and birdwatchers, farmers, and conservation organizations.",,,,-121.62615,38.50323,12,Hidden,,,,,,,,,,,,,,,,,
18,,,,"The story begins as a community effort, born at kitchen tables in Davis. ","<p>The original maps for a proposed wildlife area were drawn by two members of Yolo Audubon, Steve Chainey and Ted Beedy. They invited others to discuss their concept. The next step was to build support for the proposal, including presenting slide shows at the City of Davis Vets Memorial.</p>
<p>Building off the success of the <a href=https://putahcreekcouncil.org/ target=_blank>Putah Creek Council</a> in advocating for <a href=http://www.putahcreeklegacy.com/ target=_blank>adequate flows for fish habitat</a> during an ongoing drought in the early 1990s, members of the Council organized the Yolo Bypass Working Group to explore the concept of recreating wetlands at the Putah Creek Sinks, the creek's downstream destination.</p>",gallery:early-ybwg,,-121.70210,38.54353,12,Plain,,,,,,,,,,,,,,,,,
19,,,history,"Recognizing that most of the potential land for a wetland restoration was privately owned, the Putah Creek Council decided to work with—instead of in opposition to—local landowners.","In February 1990, the Yolo Basin Working Group sponsored a meeting with area landowners and the California Department of Fish and Game, at the California Trucking Association Building in West Sacramento, to discuss the proposal for a Yolo Basin Wildlife Area. At that meeting, Department of Fish and Game Region 2 Director Jim Messersmith committed to working with the community on creation of a wildlife area at the Putah Creek Sinks, if it could be determined that an adequate water supply existed to manage wetlands. ",media/planning6_meeting.jpg,,-121.55379,38.57285,12,Plain,,,,,,,,,,,,,,,,,"3251 Beacon Blvd, West Sacramento"
20,,,,"Later the same month, the Yolo Basin Foundation was officially founded to advocate for and coordinate the creation of a new State-owned and managed wildlife area which ultimately became the Yolo Bypass Wildlife Area. The founding board meeting was held at the kitchen table of Robin Kulakow and Bill Julian. ",,media/ybf_earlyphoto.jpg,"Left to right: Ted Beedy, Steve Chainey, Robin Kulakow, Paul Simons, Susan Sanders, Bill Julian, Manny Carbahal",,,,,,,,,,,,,,,,,,,,,
21,,,,"Yolo Basin Foundation board members and friends sought the support of elected officials who would become critical advocates of the project's success, including Congressman Vic Fazio, Yolo County Supervisors Betsy Marchand and Helen Thomson, and City Councilwoman Lois Wolk.  ",,gallery:localsupport,,,,,,,,,,,,,,,,,,,,,,
22,,,,"Thanks to the wide-ranging collaboration and advocacy efforts, in December 1991, the California Wildlife Conservation Board completed the purchase of 3100-acres of fallow row crop land—a portion of the Cowell Ranch then owned by Prudential Life Insurance—for $4.57 in funds from Proposition 70 and the State General Fund. The first milestone, land, was reached successfully.",,,,-121.60533,38.53757,13,Hidden,,1993 aerial photography (USGS Digital Ortho Quads),tiles/ortho1993/{z}/{x}/{y}.png,,,,16,,,geojson/dfw_ybwa_boundary_original_pcs.geojson,"opacity:1;color:white;weight:3;fillOpacity:0;dashArray:3,3;lineCap:butt;",,,,,,
23,,,,"In 1991, Richard Harris, then District Director for Congressman Vic Fazio met with Robin Kulakow and Bill Julian at their home in Davis.","Fazio was interested in the wetlands project. They discussed various ways in which the Congressman could support it.  A few weeks later, Harris came back with news about a new program that was recently funded for the US Army Corps of Engineers (Corps)  to do habitat restoration in areas that were destroyed by existing Corps projects.  This program became known as <a href=https://www.nae.usace.army.mil/Missions/Public-Services/Continuing-Authorities-Program/Section-1135 target=_blank>Section 1135</a>: <em>Under the authority provided by Section 1135 of the Water Resources Development Act of 1986, the U.S. Army Corps of Engineers may plan, design and build modifications to existing USACE projects, or areas degraded by USACE projects, to restore aquatic habitat for fish and wildlife</em>.",,,,,,,,,,,,,16,,,,,,,,,,
24,,,,"First, the Yolo Basin Foundation obtained letters of support from Davis City Council, Yolo County Board of Supervisors, the State Assembly and State Senate. ","Congressman Fazio then worked to get Congressional authorization and appropriation of funds for the Corps to begin the environmental documentation, state and federal permitting and engineering for the restoration of the Yolo Basin Wetlands (Section 1135 project).  ",,,,,,,,,,,,,16,,,,,,,,,,
25,,,,"On 13 February 1992, Congressman Fazio, US Army Corps of Engineers and other project members held an event on the east levee of the Yolo Bypass to celebrate the purchase of property for the Yolo Bypass Wildlife Area and the initiation of the Yolo Basin Wetlands Project. Later that day, a reception was held at UC Davis to honor Ted Beedy and Steve Chainey for their vision of restoring wetlands at the Putah Creek Sinks","Then, activity picked up on making the restoration vision a reality. In April 1992 the Final Environmental Assessment/Project Modification Report for Yolo Basin Wetlands project was released by the U.S. Army Corps of Engineers. In January 1993 Assistant Secretary of the Army gave his approval for US Army Corps staff to initiate plans and specifications for the Yolo Basin Wetlands project. On September 10, 1993 the Project Cooperation Agreement, a contract between US Army Corps of Engineers and State Fish & Game regarding cost sharing and post restoration maintenance. That November, the resource inventory of the Putah Creek Sinks, titled Suitability Analysis for Enhancing Wildlife Habitat in the Yolo Basin, was completed by Jones & Stokes Associates under contract with the Central Valley Habitat Joint Venture.",media/first_purchase_event.jpg,"Celebrating the purchase of the first 3700 acres: Dave Paullin, Steve Chainey, Ted Beedy.
",-121.58342,38.55947,14,Plain,,1993 aerial photography (USGS Digital Ortho Quads),tiles/ortho1993/{z}/{x}/{y}.png,,,,16,,,,,,,,,,
26,,,,The wetland restoration design took shape over the next two years. Initial concept plans envisioned a mosaic of north-south oriented seasonal and permanent wetlands across the Cowell Ranch. ,"State Fish and Game, Region 2 staff including Paul Hoffmann worked tirelessly with Corps staff to design the wetlands, roads, and water control structures on the recently purchased property. Governor Wilson. Signed State Senate Bill 494, sponsored by Assemblyman Tom Hannigan, which directed Caltrans to transfer the 400 acres between I-80 and the railroad tracks to Fish and Game. In April 1994 the Causeway property was transferred from Caltrans to Fish and Game for inclusion in the Yolo Basin Wetlands Project.",media/planning1.jpg,,-121.60719,38.54275,13,Hidden,,,tiles/scan_conceptualmp/{z}/{x}/{y}.png,,,,17,,,,,,,,,,
27,,,,"At the same time, 180 acres of additional property was purchased by the Wildlife Conservation Board for Department of Fish and Game to provide an entrance to the new Wildlife Area and expand habitat land to the north of I-80. ",Thirteen acres were also purchased outside the Bypass for the Wildlife Area Headquarters.,,,-121.65146,38.55508,13,Hidden,,1993 aerial photography (USGS Digital Ortho Quads),tiles/ortho1993/{z}/{x}/{y}.png,,,,17,,,geojson/dfw_ybwa_boundary_purchase_1992.geojson,"opacity:1;color:white;weight:3;fillOpacity:0;dashArray:3,3;lineCap:butt;",,,,,,
